User,tanggal waktu,review
maithichbontam,"2024-07-16 14:21 | Phân loại hàng: Full Set,XL","Màu sắc: y hìnhĐúng với mô tả: tốtChất liệu: tốtHàng rất đẹp, mình mua cả áo lẫn quần nên được giá rẻ so với chất lượng, quần lên form đẹp, siêu cute, chuẩn như ảnh nhé, sẽ tiếp tục ủng hộ shop 💗"
Người dùng Shopee,2020-12-14 21:37 | Phân loại hàng: Size M,2020-12-14 21:37 | Phân loại hàng: Size M
thucphamthietyeu,2018-08-13 07:26,Shop phục vụ rất tốt Thời gian giao hàng rất nhanh
h0llokjty,2018-05-15 07:04,Đóng gói sản phẩm rất đẹp và chắc chắn Shop phục vụ rất tốt
nhuhoanh0965,2018-09-27 11:35,Chất lượng sản phẩm tuyệt vời Thời gian giao hàng rất nhanh Shop phục vụ rất tốt
anhthu1313,2018-07-11 21:29,Quần siêu đẹp  Shop phục vụ rất tốt Rất đáng tiền
xiximuoimuoi,2019-05-19 17:48 | Phân loại hàng: Size L,shop đóng gói rất cẩn thận ! Quần y ảnh
susica,2018-12-26 21:25 | Phân loại hàng: Size M,Mặc dù thấy ảnh là quần lưng thun nhưng gửi về thì short jean lưng cao. May là vẫn mặc vừa và form đẹp.
miwanguyenn,2018-07-11 20:16 | Phân loại hàng: Size XL,Chất lượng sản phẩm tuyệt vời
_sisimato99,2018-07-21 08:57 | Phân loại hàng: Size L,Chất lượng sản phẩm tuyệt vời
jennymark,2018-05-10 02:02,Shop phục vụ rất tốt Rất đáng tiền
t*****4,2021-01-21 23:21,2021-01-21 23:21